DEVICE ID 173a:21cf on Bus 020 Address 040 =================
 bLength                :   0x12 (18 bytes)
 bDescriptorType        :    0x1 Device
 bcdUSB                 :  0x200 USB 2.0
 bDeviceClass           :    0x0 Specified at interface
 bDeviceSubClass        :    0x0
 bDeviceProtocol        :    0x0
 bMaxPacketSize0        :    0x8 (8 bytes)
 idVendor               : 0x173a
 idProduct              : 0x21cf
 bcdDevice              :  0x200 Device 2.0
 iManufacturer          :    0x1 Roche
 iProduct               :    0x2 Meter
 iSerialNumber          :    0x3 AB663A471C002800
 bNumConfigurations     :    0x1
  CONFIGURATION 1: 100 mA ==================================
   bLength              :    0x9 (9 bytes)
   bDescriptorType      :    0x2 Configuration
   wTotalLength         :   0x3d (61 bytes)
   bNumInterfaces       :    0x1
   bConfigurationValue  :    0x1
   iConfiguration       :    0x4 MSP430 USB
   bmAttributes         :   0x80 Bus Powered
   bMaxPower            :   0x32 (100 mA)
    INTERFACE 0: Personal Healthcare =======================
     bLength            :    0x9 (9 bytes)
     bDescriptorType    :    0x4 Interface
     bInterfaceNumber   :    0x0
     bAlternateSetting  :    0x0
     bNumEndpoints      :    0x2
     bInterfaceClass    :    0xf Personal Healthcare
     bInterfaceSubClass :    0x0
     bInterfaceProtocol :    0x0
     iInterface         :    0x6 PHDC Interface
      ENDPOINT 0x3: Bulk OUT ===============================
       bLength          :    0x7 (7 bytes)
       bDescriptorType  :    0x5 Endpoint
       bEndpointAddress :    0x3 OUT
       bmAttributes     :    0x2 Bulk
       wMaxPacketSize   :   0x40 (64 bytes)
       bInterval        :   0xff
      ENDPOINT 0x83: Bulk IN ===============================
       bLength          :    0x7 (7 bytes)
       bDescriptorType  :    0x5 Endpoint
       bEndpointAddress :   0x83 IN
       bmAttributes     :    0x2 Bulk
       wMaxPacketSize   :   0x40 (64 bytes)
       bInterval        :   0xff